{
  "map_version": "0.1",
  "system": {
    "id": "blank",
    "name": "（系統名稱）",
    "summary": "",
    "stores": [
      { "id": "main", "kind": "other", "label": "（存放處）" }
    ]
  },
  "roles": [
    { "id": "actor1", "label": "（角色1）", "summary": "" }
  ],
  "story": {
    "trigger": "（為什麼開始）",
    "background": "",
    "steps": [
      {
        "id": "step1",
        "label": "STEP1",
        "actor": "actor1",
        "action": "（做什麼）"
      }
    ]
  },
  "tables": [
    {
      "id": "table1",
      "label": "（表名）",
      "store": "main",
      "fields": [
        {
          "id": "field1",
          "label": "（欄名）",
          "type": "text",
          "required": true,
          "source": { "kind": "manual", "notes": "" },
          "filled_by": ["actor1"],
          "visible_to": ["actor1"],
          "editable_by": ["actor1"],
          "consumed_by": []
        }
      ]
    }
  ],
  "relations": [],
  "one_liner": "這系統就是：（誰）因為（什麼）走（幾步），資料放在（哪），每格（怎麼來／誰能動／誰用）。"
}
